{
  "caseId": "lib-example-05-extensions",
  "tier": "library",
  "legacyCommit": "9c02f26d0f81b554019441e348f981b67e11a4e7",
  "source": {
    "kind": "example",
    "name": "05-extensions"
  },
  "templateId": "ndocxtemplater-example-05-extensions",
  "templateAsset": "template.docx",
  "templateDescription": "template.txt",
  "dataDigest": "sha256:1a55059241b1e06f117df71da3e734d5eff80281c6f73c9d96729306abf61037",
  "expectedSemantic": {
    "file": "expected/semantics.json",
    "format": "ofd-compose/case-semantics@1"
  },
  "allowedDifferences": [],
  "nativeProfile": {
    "bindingPolicyVersion": "legacy-compat-1",
    "legacyPixelDpi": 96
  },
  "result": {
    "status": "pass",
    "note": "issue 05：template.txt 由 template.docx 正文转录；文本/结构语义在 ResolvedDocument 级通过（Node 与浏览器双模式，tests/golden-corpus/tests/corpus.dual.test.ts）"
  }
}
