{
  "caseId": "lib-test-05-sort-take-count-format",
  "tier": "library",
  "legacyCommit": "9c02f26d0f81b554019441e348f981b67e11a4e7",
  "source": {
    "kind": "docx-test",
    "name": "Render_SupportsSortTakeCountAndFormattingExtensions"
  },
  "templateId": "ndocxtemplater-test-05-extensions",
  "templateDescription": "template.txt",
  "dataDigest": "sha256:636067844f282178ad29f103f334d6546dd656c8f2066f9bfc2acc39729a76b0",
  "expectedSemantic": {
    "file": "expected/semantics.json",
    "format": "ofd-compose/case-semantics@1"
  },
  "allowedDifferences": [],
  "nativeProfile": {
    "bindingPolicyVersion": "legacy-compat-1",
    "legacyPixelDpi": 96
  },
  "result": {
    "status": "not-executable",
    "note": "issue 02：格式冻结，执行随后续排版票接入"
  }
}
