{
  "caseId": "lib-example-01-basic-tags",
  "tier": "library",
  "legacyCommit": "9c02f26d0f81b554019441e348f981b67e11a4e7",
  "source": {
    "kind": "example",
    "name": "01-basic-tags"
  },
  "templateId": "ndocxtemplater-example-01-basic-tags",
  "templateAsset": "template.docx",
  "templateDescription": "template.txt",
  "dataDigest": "sha256:bcd8d40eef6bc6fba40b5f86ef958ee9a2bc241705f0fe523e3500ddfd01a66a",
  "expectedSemantic": {
    "file": "expected/semantics.json",
    "format": "ofd-compose/case-semantics@1"
  },
  "allowedDifferences": [],
  "nativeProfile": {
    "bindingPolicyVersion": "legacy-compat-1",
    "legacyPixelDpi": 96
  },
  "result": {
    "status": "pass",
    "note": "issue 05：template.txt 由 template.docx 正文转录；文本/结构语义在 ResolvedDocument 级通过（Node 与浏览器双模式，tests/golden-corpus/tests/corpus.dual.test.ts）"
  }
}
