{
  "caseId": "lib-test-03-loop-orders",
  "tier": "library",
  "legacyCommit": "9c02f26d0f81b554019441e348f981b67e11a4e7",
  "source": {
    "kind": "docx-test",
    "name": "Render_EvaluatesLoopBlocks"
  },
  "templateId": "ndocxtemplater-test-03-loop",
  "templateDescription": "template.txt",
  "dataDigest": "sha256:f81e266c59c8567654d9b460b11c09713c359e58752ece49bb8767d450b7a62f",
  "expectedSemantic": {
    "file": "expected/semantics.json",
    "format": "ofd-compose/case-semantics@1"
  },
  "allowedDifferences": [],
  "nativeProfile": {
    "bindingPolicyVersion": "legacy-compat-1",
    "legacyPixelDpi": 96
  },
  "result": {
    "status": "pass",
    "note": "issue 05：结构类用例（条件块/重复块/表格行组）在 ResolvedDocument 级通过（Node 与浏览器双模式，tests/golden-corpus/tests/corpus.dual.test.ts）"
  }
}
