{
  "caseId": "lib-test-06-narrative-aggregates",
  "tier": "library",
  "legacyCommit": "9c02f26d0f81b554019441e348f981b67e11a4e7",
  "source": {
    "kind": "docx-test",
    "name": "Render_SupportsInlineFriendlyAggregateExpressions_ForNarrativeParagraphs"
  },
  "templateId": "ndocxtemplater-test-06-inline-friendly",
  "templateDescription": "template.txt",
  "dataDigest": "sha256:731ec880fa291faeade6503204b9a9c0e3b57c0ebcdfa69464d290dbe54ae314",
  "expectedSemantic": {
    "file": "expected/semantics.json",
    "format": "ofd-compose/case-semantics@1"
  },
  "allowedDifferences": [],
  "nativeProfile": {
    "bindingPolicyVersion": "legacy-compat-1",
    "legacyPixelDpi": 96
  },
  "result": {
    "status": "pass",
    "note": "issue 04：叙述类用例在 ResolvedDocument 级通过（Node 与浏览器双模式，tests/golden-corpus/tests/narrative-corpus.dual.test.ts）"
  }
}
