{
  "caseId": "lib-example-04-table-loop",
  "tier": "library",
  "legacyCommit": "9c02f26d0f81b554019441e348f981b67e11a4e7",
  "source": {
    "kind": "example",
    "name": "04-table-loop"
  },
  "templateId": "ndocxtemplater-example-04-table-loop",
  "templateAsset": "template.docx",
  "dataDigest": "sha256:c60336cb4a3bf09ebc70ef7977bbaa6c260a93633aa94e64e6f7b5c9e4dd280c",
  "expectedSemantic": {
    "file": "expected/semantics.json",
    "format": "ofd-compose/case-semantics@1"
  },
  "allowedDifferences": [],
  "nativeProfile": {
    "bindingPolicyVersion": "legacy-compat-1",
    "legacyPixelDpi": 96
  },
  "result": {
    "status": "not-executable",
    "note": "issue 02：格式冻结，执行随后续排版票接入"
  }
}
