{
  "caseId": "lib-example-10-inline-conditions-rates",
  "tier": "library",
  "legacyCommit": "9c02f26d0f81b554019441e348f981b67e11a4e7",
  "source": {
    "kind": "example",
    "name": "10-inline-conditions-and-rates"
  },
  "templateId": "ndocxtemplater-example-10-inline-conditions-and-rates",
  "templateAsset": "template.docx",
  "templateDescription": "template.txt",
  "dataDigest": "sha256:195290ebc6f822eb760e3b880c99f24858f076c2aaf75a5aef693f906790f9aa",
  "expectedSemantic": {
    "file": "expected/semantics.json",
    "format": "ofd-compose/case-semantics@1"
  },
  "allowedDifferences": [],
  "nativeProfile": {
    "bindingPolicyVersion": "legacy-compat-1",
    "legacyPixelDpi": 96
  },
  "result": {
    "status": "pass",
    "note": "issue 05：template.txt 由 template.docx 正文转录；文本/结构语义在 ResolvedDocument 级通过（Node 与浏览器双模式，tests/golden-corpus/tests/corpus.dual.test.ts）"
  }
}
