{
  "caseId": "lib-example-02-condition",
  "tier": "library",
  "legacyCommit": "9c02f26d0f81b554019441e348f981b67e11a4e7",
  "source": {
    "kind": "example",
    "name": "02-condition"
  },
  "templateId": "ndocxtemplater-example-02-condition",
  "templateAsset": "template.docx",
  "templateDescription": "template.txt",
  "dataDigest": "sha256:0d769f0694a084e8b45c54a64573d2383650641215d1da3f6d9ca5ee5a42ce6d",
  "expectedSemantic": {
    "file": "expected/semantics.json",
    "format": "ofd-compose/case-semantics@1"
  },
  "allowedDifferences": [],
  "nativeProfile": {
    "bindingPolicyVersion": "legacy-compat-1",
    "legacyPixelDpi": 96
  },
  "result": {
    "status": "pass",
    "note": "issue 05：template.txt 由 template.docx 正文转录；文本/结构语义在 ResolvedDocument 级通过（Node 与浏览器双模式，tests/golden-corpus/tests/corpus.dual.test.ts）"
  }
}
